{
  "$schema": "https://json-schema.org/draft/2020-12/schema",
  "$id": "https://github.com/mudler/vllm.cpp/release/manifest-v1.schema.json",
  "title": "vllm.cpp binary release manifest v1",
  "type": "object",
  "additionalProperties": false,
  "required": [
    "schema",
    "schema_version",
    "artifact",
    "host",
    "backend",
    "dependencies",
    "build",
    "supply_chain",
    "evidence"
  ],
  "properties": {
    "schema": {
      "const": "vllm.cpp.release-manifest.v1"
    },
    "schema_version": {
      "type": "integer",
      "const": 1
    },
    "artifact": {
      "$ref": "#/$defs/artifact"
    },
    "host": {
      "$ref": "#/$defs/host"
    },
    "backend": {
      "$ref": "#/$defs/backend"
    },
    "dependencies": {
      "type": "array",
      "minItems": 1,
      "items": {
        "$ref": "#/$defs/dependency"
      }
    },
    "build": {
      "$ref": "#/$defs/build"
    },
    "supply_chain": {
      "$ref": "#/$defs/supplyChain"
    },
    "cpu": {
      "$ref": "#/$defs/cpu"
    },
    "cuda": {
      "$ref": "#/$defs/cuda"
    },
    "evidence": {
      "$ref": "#/$defs/evidenceSet"
    }
  },
  "$defs": {
    "artifact": {
      "type": "object",
      "additionalProperties": false,
      "required": ["id", "version", "channel", "kind", "static_boundary"],
      "properties": {
        "id": {"type": "string", "minLength": 1},
        "version": {"type": "string", "minLength": 1},
        "channel": {
          "enum": ["stable", "preview", "experimental-preview"]
        },
        "kind": {"enum": ["primary", "diagnostic"]},
        "static_boundary": {"enum": ["static-core", "literal-static"]}
      }
    },
    "host": {
      "type": "object",
      "additionalProperties": false,
      "required": ["os", "arch", "abi", "abi_version"],
      "properties": {
        "os": {"enum": ["linux", "macos"]},
        "arch": {"enum": ["x86_64", "aarch64"]},
        "abi": {"enum": ["glibc", "musl", "macos"]},
        "abi_version": {"type": "string", "minLength": 1}
      }
    },
    "backendFlags": {
      "type": "object",
      "additionalProperties": false,
      "required": [
        "MLX_ROOT",
        "VLLM_CPP_BUILD_EXAMPLES",
        "VLLM_CPP_BUILD_TESTS",
        "VLLM_CPP_CUDA",
        "VLLM_CPP_CUDA_ARCHITECTURES",
        "VLLM_CPP_HIP",
        "VLLM_CPP_HIP_ARCHITECTURES",
        "VLLM_CPP_METAL",
        "VLLM_CPP_MLX",
        "VLLM_CPP_SERVER",
        "VLLM_CPP_TRITON",
        "VLLM_CPP_VULKAN"
      ],
      "properties": {
        "MLX_ROOT": {"type": "string"},
        "VLLM_CPP_BUILD_EXAMPLES": {"type": "boolean"},
        "VLLM_CPP_BUILD_TESTS": {"type": "boolean"},
        "VLLM_CPP_CUDA": {"type": "boolean"},
        "VLLM_CPP_CUDA_ARCHITECTURES": {
          "type": "array",
          "items": {"type": "string", "minLength": 1},
          "uniqueItems": true
        },
        "VLLM_CPP_HIP": {"type": "boolean"},
        "VLLM_CPP_HIP_ARCHITECTURES": {
          "type": "array",
          "items": {"type": "string", "minLength": 1},
          "uniqueItems": true
        },
        "VLLM_CPP_METAL": {"type": "boolean"},
        "VLLM_CPP_MLX": {"type": "boolean"},
        "VLLM_CPP_SERVER": {"type": "boolean"},
        "VLLM_CPP_TRITON": {"type": "boolean"},
        "VLLM_CPP_VULKAN": {"type": "boolean"}
      }
    },
    "resolvedFeature": {
      "type": "object",
      "additionalProperties": false,
      "required": ["name", "compiled_sms"],
      "properties": {
        "name": {"type": "string", "minLength": 1},
        "compiled_sms": {
          "type": "array",
          "items": {"type": "string", "minLength": 1},
          "uniqueItems": true
        }
      }
    },
    "backend": {
      "type": "object",
      "additionalProperties": false,
      "required": ["name", "flags", "resolved_features", "gpu_driver_boundary"],
      "properties": {
        "name": {"enum": ["cpu", "cuda", "metal", "mlx", "vulkan"]},
        "flags": {"$ref": "#/$defs/backendFlags"},
        "resolved_features": {
          "type": "array",
          "items": {"$ref": "#/$defs/resolvedFeature"}
        },
        "gpu_driver_boundary": {
          "enum": ["not-applicable", "external-host-never-bundled"]
        }
      }
    },
    "dependency": {
      "type": "object",
      "additionalProperties": false,
      "required": ["name", "version", "kind", "linkage", "bundled", "role"],
      "properties": {
        "name": {"type": "string", "minLength": 1},
        "version": {"type": "string", "minLength": 1},
        "kind": {"enum": ["library", "framework", "driver", "tool"]},
        "linkage": {"enum": ["static", "dynamic", "external"]},
        "bundled": {"type": "boolean"},
        "role": {"enum": ["build-time", "runtime", "external-runtime"]}
      }
    },
    "build": {
      "type": "object",
      "additionalProperties": false,
      "required": [
        "source_commit",
        "source_clean",
        "compiler",
        "toolchain",
        "resolved_cmake_options",
        "test_commands"
      ],
      "properties": {
        "source_commit": {"type": "string", "minLength": 40},
        "source_clean": {"type": "boolean"},
        "compiler": {"type": "string", "minLength": 1},
        "toolchain": {"type": "string", "minLength": 1},
        "resolved_cmake_options": {"$ref": "#/$defs/backendFlags"},
        "test_commands": {
          "type": "array",
          "minItems": 1,
          "items": {"type": "string", "minLength": 1},
          "uniqueItems": true
        }
      }
    },
    "evidence": {
      "type": "object",
      "additionalProperties": false,
      "required": ["state", "reason", "command", "result", "url"],
      "properties": {
        "state": {"enum": ["absent", "not-applicable", "failed", "passed"]},
        "reason": {"type": "string"},
        "command": {"type": "string"},
        "result": {"type": "string"},
        "url": {"type": "string"}
      }
    },
    "evidenceSet": {
      "type": "object",
      "additionalProperties": false,
      "required": [
        "build",
        "archive_smoke",
        "dependency_audit",
        "runtime",
        "correctness",
        "performance"
      ],
      "properties": {
        "build": {"$ref": "#/$defs/evidence"},
        "archive_smoke": {"$ref": "#/$defs/evidence"},
        "dependency_audit": {"$ref": "#/$defs/evidence"},
        "runtime": {"$ref": "#/$defs/evidence"},
        "correctness": {"$ref": "#/$defs/evidence"},
        "performance": {"$ref": "#/$defs/evidence"}
      }
    },
    "supplyChain": {
      "type": "object",
      "additionalProperties": false,
      "required": ["archive_checksum", "sbom", "provenance", "licenses"],
      "properties": {
        "archive_checksum": {"$ref": "#/$defs/evidence"},
        "sbom": {"$ref": "#/$defs/evidence"},
        "provenance": {"$ref": "#/$defs/evidence"},
        "licenses": {"$ref": "#/$defs/evidence"}
      }
    },
    "cpuTier": {
      "type": "object",
      "additionalProperties": false,
      "required": [
        "name",
        "kernel_families",
        "required_cpu_bits",
        "required_os_state",
        "execution_evidence"
      ],
      "properties": {
        "name": {"type": "string", "minLength": 1},
        "kernel_families": {
          "type": "array",
          "minItems": 1,
          "items": {"type": "string", "minLength": 1},
          "uniqueItems": true
        },
        "required_cpu_bits": {
          "type": "array",
          "minItems": 1,
          "items": {"type": "string", "minLength": 1},
          "uniqueItems": true
        },
        "required_os_state": {
          "type": "array",
          "items": {"type": "string", "minLength": 1},
          "uniqueItems": true
        },
        "execution_evidence": {"$ref": "#/$defs/evidence"}
      }
    },
    "cpu": {
      "type": "object",
      "additionalProperties": false,
      "required": ["baseline", "selected_tier", "compiled_tiers"],
      "properties": {
        "baseline": {"type": "string", "minLength": 1},
        "selected_tier": {"type": "string", "minLength": 1},
        "compiled_tiers": {
          "type": "array",
          "minItems": 1,
          "items": {"$ref": "#/$defs/cpuTier"}
        }
      }
    },
    "smEvidence": {
      "type": "object",
      "additionalProperties": false,
      "required": [
        "sm",
        "aot_available",
        "portable_fallback",
        "aot_evidence",
        "runtime_evidence"
      ],
      "properties": {
        "sm": {"type": "string", "minLength": 1},
        "aot_available": {"type": "boolean"},
        "portable_fallback": {"type": "boolean"},
        "aot_evidence": {"$ref": "#/$defs/evidence"},
        "runtime_evidence": {"$ref": "#/$defs/evidence"}
      }
    },
    "cuda": {
      "type": "object",
      "additionalProperties": false,
      "required": ["compiled_sms", "sm_evidence"],
      "properties": {
        "compiled_sms": {
          "type": "array",
          "minItems": 1,
          "items": {"type": "string", "minLength": 1},
          "uniqueItems": true
        },
        "sm_evidence": {
          "type": "array",
          "minItems": 1,
          "items": {"$ref": "#/$defs/smEvidence"}
        }
      }
    }
  }
}
